"No.","Time","Source","Destination","Protocol","Length","Info"
"1","0.000000","127.0.0.1","127.0.0.1","TCP","56","61838  >  49350 [SYN] Seq=0 Win=65535 Len=0 MSS=65495 WS=256 SACK_PERM"
"2","0.000111","127.0.0.1","127.0.0.1","TCP","56","49350  >  61838 [SYN, ACK] Seq=0 Ack=1 Win=65535 Len=0 MSS=65495 WS=256 SACK_PERM"
"3","0.000169","127.0.0.1","127.0.0.1","TCP","44","61838  >  49350 [ACK] Seq=1 Ack=1 Win=65280 Len=0"
"4","0.000262","127.0.0.1","127.0.0.1","TCP","41132","61838  >  49350 [PSH, ACK] Seq=1 Ack=1 Win=65280 Len=41088"
"5","0.000312","127.0.0.1","127.0.0.1","TCP","44","49350  >  61838 [ACK] Seq=1 Ack=41089 Win=130816 Len=0"
"6","0.000337","127.0.0.1","127.0.0.1","TCP","44","61838  >  49350 [FIN, ACK] Seq=41089 Ack=1 Win=65280 Len=0"
"7","0.000349","127.0.0.1","127.0.0.1","TCP","44","49350  >  61838 [ACK] Seq=1 Ack=41090 Win=130816 Len=0"
"8","0.000643","127.0.0.1","127.0.0.1","TCP","56","61839  >  49350 [SYN] Seq=0 Win=65535 Len=0 MSS=65495 WS=256 SACK_PERM"
"9","0.000697","127.0.0.1","127.0.0.1","TCP","56","49350  >  61839 [SYN, ACK] Seq=0 Ack=1 Win=65535 Len=0 MSS=65495 WS=256 SACK_PERM"
"10","0.000729","127.0.0.1","127.0.0.1","TCP","44","61839  >  49350 [ACK] Seq=1 Ack=1 Win=65280 Len=0"
"11","0.000777","127.0.0.1","127.0.0.1","TCP","41132","61839  >  49350 [PSH, ACK] Seq=1 Ack=1 Win=65280 Len=41088"
"12","0.000826","127.0.0.1","127.0.0.1","TCP","44","49350  >  61839 [ACK] Seq=1 Ack=41089 Win=130816 Len=0"
"13","0.000841","127.0.0.1","127.0.0.1","TCP","44","61839  >  49350 [FIN, ACK] Seq=41089 Ack=1 Win=65280 Len=0"
"14","0.000852","127.0.0.1","127.0.0.1","TCP","44","49350  >  61839 [ACK] Seq=1 Ack=41090 Win=130816 Len=0"
"15","0.031680","127.0.0.1","127.0.0.1","TCP","44","49350  >  61838 [FIN, ACK] Seq=1 Ack=41090 Win=130816 Len=0"
"16","0.031738","127.0.0.1","127.0.0.1","TCP","44","61838  >  49350 [ACK] Seq=41090 Ack=2 Win=65280 Len=0"
"17","0.063493","127.0.0.1","127.0.0.1","TCP","44","49350  >  61837 [FIN, ACK] Seq=1 Ack=1 Win=511 Len=0"
"18","0.063543","127.0.0.1","127.0.0.1","TCP","44","61837  >  49350 [ACK] Seq=1 Ack=2 Win=255 Len=0"
"19","1.006036","127.0.0.1","127.0.0.1","TCP","56","61840  >  49350 [SYN] Seq=0 Win=65535 Len=0 MSS=65495 WS=256 SACK_PERM"
"20","1.006093","127.0.0.1","127.0.0.1","TCP","56","49350  >  61840 [SYN, ACK] Seq=0 Ack=1 Win=65535 Len=0 MSS=65495 WS=256 SACK_PERM"
"21","1.006134","127.0.0.1","127.0.0.1","TCP","44","61840  >  49350 [ACK] Seq=1 Ack=1 Win=65280 Len=0"
"22","1.006189","127.0.0.1","127.0.0.1","TCP","41132","61840  >  49350 [PSH, ACK] Seq=1 Ack=1 Win=65280 Len=41088"
"23","1.006221","127.0.0.1","127.0.0.1","TCP","44","49350  >  61840 [ACK] Seq=1 Ack=41089 Win=130816 Len=0"
"24","1.006235","127.0.0.1","127.0.0.1","TCP","44","61840  >  49350 [FIN, ACK] Seq=41089 Ack=1 Win=65280 Len=0"
"25","1.006245","127.0.0.1","127.0.0.1","TCP","44","49350  >  61840 [ACK] Seq=1 Ack=41090 Win=130816 Len=0"
"26","1.006422","127.0.0.1","127.0.0.1","TCP","56","61841  >  49350 [SYN] Seq=0 Win=65535 Len=0 MSS=65495 WS=256 SACK_PERM"
"27","1.006456","127.0.0.1","127.0.0.1","TCP","56","49350  >  61841 [SYN, ACK] Seq=0 Ack=1 Win=65535 Len=0 MSS=65495 WS=256 SACK_PERM"
"28","1.006479","127.0.0.1","127.0.0.1","TCP","44","61841  >  49350 [ACK] Seq=1 Ack=1 Win=65280 Len=0"
"29","1.006510","127.0.0.1","127.0.0.1","TCP","41132","61841  >  49350 [PSH, ACK] Seq=1 Ack=1 Win=65280 Len=41088"
"30","1.006539","127.0.0.1","127.0.0.1","TCP","44","49350  >  61841 [ACK] Seq=1 Ack=41089 Win=130816 Len=0"
"31","1.006550","127.0.0.1","127.0.0.1","TCP","44","61841  >  49350 [FIN, ACK] Seq=41089 Ack=1 Win=65280 Len=0"
"32","1.006557","127.0.0.1","127.0.0.1","TCP","44","49350  >  61841 [ACK] Seq=1 Ack=41090 Win=130816 Len=0"
"33","1.037304","127.0.0.1","127.0.0.1","TCP","44","49350  >  61840 [FIN, ACK] Seq=1 Ack=41090 Win=130816 Len=0"
"34","1.037343","127.0.0.1","127.0.0.1","TCP","44","61840  >  49350 [ACK] Seq=41090 Ack=2 Win=65280 Len=0"
"35","1.069764","127.0.0.1","127.0.0.1","TCP","44","49350  >  61839 [FIN, ACK] Seq=1 Ack=41090 Win=130816 Len=0"
"36","1.069799","127.0.0.1","127.0.0.1","TCP","44","61839  >  49350 [ACK] Seq=41090 Ack=2 Win=65280 Len=0"
"37","2.020919","127.0.0.1","127.0.0.1","TCP","56","61842  >  49350 [SYN] Seq=0 Win=65535 Len=0 MSS=65495 WS=256 SACK_PERM"
"38","2.020986","127.0.0.1","127.0.0.1","TCP","56","49350  >  61842 [SYN, ACK] Seq=0 Ack=1 Win=65535 Len=0 MSS=65495 WS=256 SACK_PERM"
"39","2.021034","127.0.0.1","127.0.0.1","TCP","44","61842  >  49350 [ACK] Seq=1 Ack=1 Win=65280 Len=0"
"40","2.021098","127.0.0.1","127.0.0.1","TCP","41132","61842  >  49350 [PSH, ACK] Seq=1 Ack=1 Win=65280 Len=41088"
"41","2.021141","127.0.0.1","127.0.0.1","TCP","44","49350  >  61842 [ACK] Seq=1 Ack=41089 Win=130816 Len=0"
"42","2.021160","127.0.0.1","127.0.0.1","TCP","44","61842  >  49350 [FIN, ACK] Seq=41089 Ack=1 Win=65280 Len=0"
"43","2.021171","127.0.0.1","127.0.0.1","TCP","44","49350  >  61842 [ACK] Seq=1 Ack=41090 Win=130816 Len=0"
"44","2.051409","127.0.0.1","127.0.0.1","TCP","44","49350  >  61842 [FIN, ACK] Seq=1 Ack=41090 Win=130816 Len=0"
"45","2.051452","127.0.0.1","127.0.0.1","TCP","44","61842  >  49350 [ACK] Seq=41090 Ack=2 Win=65280 Len=0"
"46","2.080893","127.0.0.1","127.0.0.1","TCP","44","49350  >  61841 [FIN, ACK] Seq=1 Ack=41090 Win=130816 Len=0"
"47","2.080938","127.0.0.1","127.0.0.1","TCP","44","61841  >  49350 [ACK] Seq=41090 Ack=2 Win=65280 Len=0"
"48","3.027699","127.0.0.1","127.0.0.1","TCP","56","61846  >  49350 [SYN] Seq=0 Win=65535 Len=0 MSS=65495 WS=256 SACK_PERM"
"49","3.027761","127.0.0.1","127.0.0.1","TCP","56","49350  >  61846 [SYN, ACK] Seq=0 Ack=1 Win=65535 Len=0 MSS=65495 WS=256 SACK_PERM"
"50","3.027802","127.0.0.1","127.0.0.1","TCP","44","61846  >  49350 [ACK] Seq=1 Ack=1 Win=65280 Len=0"
"51","3.027853","127.0.0.1","127.0.0.1","TCP","41132","61846  >  49350 [PSH, ACK] Seq=1 Ack=1 Win=65280 Len=41088"
"52","3.027889","127.0.0.1","127.0.0.1","TCP","44","49350  >  61846 [ACK] Seq=1 Ack=41089 Win=130816 Len=0"
"53","3.027906","127.0.0.1","127.0.0.1","TCP","44","61846  >  49350 [FIN, ACK] Seq=41089 Ack=1 Win=65280 Len=0"
"54","3.027917","127.0.0.1","127.0.0.1","TCP","44","49350  >  61846 [ACK] Seq=1 Ack=41090 Win=130816 Len=0"
"55","3.059160","127.0.0.1","127.0.0.1","TCP","44","49350  >  61846 [FIN, ACK] Seq=1 Ack=41090 Win=130816 Len=0"
"56","3.059200","127.0.0.1","127.0.0.1","TCP","44","61846  >  49350 [ACK] Seq=41090 Ack=2 Win=65280 Len=0"
"57","3.619566","127.0.0.1","127.0.0.1","TCP","56","61847  >  49350 [SYN] Seq=0 Win=65535 Len=0 MSS=65495 WS=256 SACK_PERM"
"58","3.619636","127.0.0.1","127.0.0.1","TCP","56","49350  >  61847 [SYN, ACK] Seq=0 Ack=1 Win=65535 Len=0 MSS=65495 WS=256 SACK_PERM"
"59","3.619677","127.0.0.1","127.0.0.1","TCP","44","61847  >  49350 [ACK] Seq=1 Ack=1 Win=65280 Len=0"
"60","3.619739","127.0.0.1","127.0.0.1","TCP","41132","61847  >  49350 [PSH, ACK] Seq=1 Ack=1 Win=65280 Len=41088"
"61","3.619772","127.0.0.1","127.0.0.1","TCP","44","49350  >  61847 [ACK] Seq=1 Ack=41089 Win=130816 Len=0"
"62","3.619788","127.0.0.1","127.0.0.1","TCP","44","61847  >  49350 [FIN, ACK] Seq=41089 Ack=1 Win=65280 Len=0"
"63","3.619798","127.0.0.1","127.0.0.1","TCP","44","49350  >  61847 [ACK] Seq=1 Ack=41090 Win=130816 Len=0"
"64","3.731761","127.0.0.1","127.0.0.1","TCP","44","49350  >  61847 [FIN, ACK] Seq=1 Ack=41090 Win=130816 Len=0"
"65","3.731799","127.0.0.1","127.0.0.1","TCP","44","61847  >  49350 [ACK] Seq=41090 Ack=2 Win=65280 Len=0"
"66","5.623584","127.0.0.1","127.0.0.1","TCP","56","61848  >  49350 [SYN] Seq=0 Win=65535 Len=0 MSS=65495 WS=256 SACK_PERM"
"67","5.623652","127.0.0.1","127.0.0.1","TCP","56","49350  >  61848 [SYN, ACK] Seq=0 Ack=1 Win=65535 Len=0 MSS=65495 WS=256 SACK_PERM"
"68","5.623693","127.0.0.1","127.0.0.1","TCP","44","61848  >  49350 [ACK] Seq=1 Ack=1 Win=65280 Len=0"
"69","5.623750","127.0.0.1","127.0.0.1","TCP","41132","61848  >  49350 [PSH, ACK] Seq=1 Ack=1 Win=65280 Len=41088"
"70","5.623793","127.0.0.1","127.0.0.1","TCP","44","49350  >  61848 [ACK] Seq=1 Ack=41089 Win=130816 Len=0"
"71","5.623816","127.0.0.1","127.0.0.1","TCP","44","61848  >  49350 [FIN, ACK] Seq=41089 Ack=1 Win=65280 Len=0"
"72","5.623827","127.0.0.1","127.0.0.1","TCP","44","49350  >  61848 [ACK] Seq=1 Ack=41090 Win=130816 Len=0"
"73","5.735304","127.0.0.1","127.0.0.1","TCP","44","49350  >  61848 [FIN, ACK] Seq=1 Ack=41090 Win=130816 Len=0"
"74","5.735346","127.0.0.1","127.0.0.1","TCP","44","61848  >  49350 [ACK] Seq=41090 Ack=2 Win=65280 Len=0"
"75","7.065910","127.0.0.1","127.0.0.1","TCP","56","61849  >  49350 [SYN] Seq=0 Win=65535 Len=0 MSS=65495 WS=256 SACK_PERM"
"76","7.065972","127.0.0.1","127.0.0.1","TCP","56","49350  >  61849 [SYN, ACK] Seq=0 Ack=1 Win=65535 Len=0 MSS=65495 WS=256 SACK_PERM"
"77","7.066016","127.0.0.1","127.0.0.1","TCP","44","61849  >  49350 [ACK] Seq=1 Ack=1 Win=65280 Len=0"
"78","7.066082","127.0.0.1","127.0.0.1","TCP","41132","61849  >  49350 [PSH, ACK] Seq=1 Ack=1 Win=65280 Len=41088"
"79","7.066120","127.0.0.1","127.0.0.1","TCP","44","49350  >  61849 [ACK] Seq=1 Ack=41089 Win=130816 Len=0"
"80","7.066147","127.0.0.1","127.0.0.1","TCP","44","61849  >  49350 [FIN, ACK] Seq=41089 Ack=1 Win=65280 Len=0"
"81","7.066161","127.0.0.1","127.0.0.1","TCP","44","49350  >  61849 [ACK] Seq=1 Ack=41090 Win=130816 Len=0"
"82","7.098126","127.0.0.1","127.0.0.1","TCP","44","49350  >  61849 [FIN, ACK] Seq=1 Ack=41090 Win=130816 Len=0"
"83","7.098199","127.0.0.1","127.0.0.1","TCP","44","61849  >  49350 [ACK] Seq=41090 Ack=2 Win=65280 Len=0"
"84","12.114685","127.0.0.1","127.0.0.1","TCP","56","61850  >  49350 [SYN] Seq=0 Win=65535 Len=0 MSS=65495 WS=256 SACK_PERM"
"85","12.114745","127.0.0.1","127.0.0.1","TCP","56","49350  >  61850 [SYN, ACK] Seq=0 Ack=1 Win=65535 Len=0 MSS=65495 WS=256 SACK_PERM"
"86","12.114790","127.0.0.1","127.0.0.1","TCP","44","61850  >  49350 [ACK] Seq=1 Ack=1 Win=65280 Len=0"
"87","12.114864","127.0.0.1","127.0.0.1","TCP","41132","61850  >  49350 [PSH, ACK] Seq=1 Ack=1 Win=65280 Len=41088"
"88","12.114902","127.0.0.1","127.0.0.1","TCP","44","49350  >  61850 [ACK] Seq=1 Ack=41089 Win=130816 Len=0"
"89","12.114921","127.0.0.1","127.0.0.1","TCP","44","61850  >  49350 [FIN, ACK] Seq=41089 Ack=1 Win=65280 Len=0"
"90","12.114932","127.0.0.1","127.0.0.1","TCP","44","49350  >  61850 [ACK] Seq=1 Ack=41090 Win=130816 Len=0"
"91","12.146026","127.0.0.1","127.0.0.1","TCP","44","49350  >  61850 [FIN, ACK] Seq=1 Ack=41090 Win=130816 Len=0"
"92","12.146071","127.0.0.1","127.0.0.1","TCP","44","61850  >  49350 [ACK] Seq=41090 Ack=2 Win=65280 Len=0"
"93","13.124493","127.0.0.1","127.0.0.1","TCP","56","61851  >  49350 [SYN] Seq=0 Win=65535 Len=0 MSS=65495 WS=256 SACK_PERM"
"94","13.124561","127.0.0.1","127.0.0.1","TCP","56","49350  >  61851 [SYN, ACK] Seq=0 Ack=1 Win=65535 Len=0 MSS=65495 WS=256 SACK_PERM"
"95","13.124604","127.0.0.1","127.0.0.1","TCP","44","61851  >  49350 [ACK] Seq=1 Ack=1 Win=65280 Len=0"
"96","13.124666","127.0.0.1","127.0.0.1","TCP","41132","61851  >  49350 [PSH, ACK] Seq=1 Ack=1 Win=65280 Len=41088"
"97","13.124712","127.0.0.1","127.0.0.1","TCP","44","49350  >  61851 [ACK] Seq=1 Ack=41089 Win=130816 Len=0"
"98","13.124741","127.0.0.1","127.0.0.1","TCP","44","61851  >  49350 [FIN, ACK] Seq=41089 Ack=1 Win=65280 Len=0"
"99","13.124751","127.0.0.1","127.0.0.1","TCP","44","49350  >  61851 [ACK] Seq=1 Ack=41090 Win=130816 Len=0"
"100","13.156035","127.0.0.1","127.0.0.1","TCP","44","49350  >  61851 [FIN, ACK] Seq=1 Ack=41090 Win=130816 Len=0"
"101","13.156078","127.0.0.1","127.0.0.1","TCP","44","61851  >  49350 [ACK] Seq=41090 Ack=2 Win=65280 Len=0"
"102","17.179070","127.0.0.1","127.0.0.1","TCP","56","61852  >  49350 [SYN] Seq=0 Win=65535 Len=0 MSS=65495 WS=256 SACK_PERM"
"103","17.179143","127.0.0.1","127.0.0.1","TCP","56","49350  >  61852 [SYN, ACK] Seq=0 Ack=1 Win=65535 Len=0 MSS=65495 WS=256 SACK_PERM"
"104","17.179198","127.0.0.1","127.0.0.1","TCP","44","61852  >  49350 [ACK] Seq=1 Ack=1 Win=65280 Len=0"
"105","17.179282","127.0.0.1","127.0.0.1","TCP","41132","61852  >  49350 [PSH, ACK] Seq=1 Ack=1 Win=65280 Len=41088"
"106","17.179330","127.0.0.1","127.0.0.1","TCP","44","49350  >  61852 [ACK] Seq=1 Ack=41089 Win=130816 Len=0"
"107","17.179355","127.0.0.1","127.0.0.1","TCP","44","61852  >  49350 [FIN, ACK] Seq=41089 Ack=1 Win=65280 Len=0"
"108","17.179369","127.0.0.1","127.0.0.1","TCP","44","49350  >  61852 [ACK] Seq=1 Ack=41090 Win=130816 Len=0"
"109","17.210203","127.0.0.1","127.0.0.1","TCP","44","49350  >  61852 [FIN, ACK] Seq=1 Ack=41090 Win=130816 Len=0"
"110","17.210257","127.0.0.1","127.0.0.1","TCP","44","61852  >  49350 [ACK] Seq=41090 Ack=2 Win=65280 Len=0"
"111","21.232598","127.0.0.1","127.0.0.1","TCP","56","61856  >  49350 [SYN] Seq=0 Win=65535 Len=0 MSS=65495 WS=256 SACK_PERM"
"112","21.232668","127.0.0.1","127.0.0.1","TCP","56","49350  >  61856 [SYN, ACK] Seq=0 Ack=1 Win=65535 Len=0 MSS=65495 WS=256 SACK_PERM"
"113","21.232711","127.0.0.1","127.0.0.1","TCP","44","61856  >  49350 [ACK] Seq=1 Ack=1 Win=65280 Len=0"
"114","21.232765","127.0.0.1","127.0.0.1","TCP","41132","61856  >  49350 [PSH, ACK] Seq=1 Ack=1 Win=65280 Len=41088"
"115","21.232803","127.0.0.1","127.0.0.1","TCP","44","49350  >  61856 [ACK] Seq=1 Ack=41089 Win=130816 Len=0"
"116","21.232819","127.0.0.1","127.0.0.1","TCP","44","61856  >  49350 [FIN, ACK] Seq=41089 Ack=1 Win=65280 Len=0"
"117","21.232829","127.0.0.1","127.0.0.1","TCP","44","49350  >  61856 [ACK] Seq=1 Ack=41090 Win=130816 Len=0"
"118","21.264035","127.0.0.1","127.0.0.1","TCP","44","49350  >  61856 [FIN, ACK] Seq=1 Ack=41090 Win=130816 Len=0"
"119","21.264081","127.0.0.1","127.0.0.1","TCP","44","61856  >  49350 [ACK] Seq=41090 Ack=2 Win=65280 Len=0"
"120","32.367843","127.0.0.1","127.0.0.1","TCP","56","61858  >  49350 [SYN] Seq=0 Win=65535 Len=0 MSS=65495 WS=256 SACK_PERM"
"121","32.367904","127.0.0.1","127.0.0.1","TCP","56","49350  >  61858 [SYN, ACK] Seq=0 Ack=1 Win=65535 Len=0 MSS=65495 WS=256 SACK_PERM"
"122","32.367945","127.0.0.1","127.0.0.1","TCP","44","61858  >  49350 [ACK] Seq=1 Ack=1 Win=65280 Len=0"
"123","32.368008","127.0.0.1","127.0.0.1","TCP","41132","61858  >  49350 [PSH, ACK] Seq=1 Ack=1 Win=65280 Len=41088"
"124","32.368040","127.0.0.1","127.0.0.1","TCP","44","49350  >  61858 [ACK] Seq=1 Ack=41089 Win=130816 Len=0"
"125","32.368056","127.0.0.1","127.0.0.1","TCP","44","61858  >  49350 [FIN, ACK] Seq=41089 Ack=1 Win=65280 Len=0"
"126","32.368075","127.0.0.1","127.0.0.1","TCP","44","49350  >  61858 [ACK] Seq=1 Ack=41090 Win=130816 Len=0"
"127","32.368257","127.0.0.1","127.0.0.1","TCP","56","61859  >  49350 [SYN] Seq=0 Win=65535 Len=0 MSS=65495 WS=256 SACK_PERM"
"128","32.368303","127.0.0.1","127.0.0.1","TCP","56","49350  >  61859 [SYN, ACK] Seq=0 Ack=1 Win=65535 Len=0 MSS=65495 WS=256 SACK_PERM"
"129","32.368330","127.0.0.1","127.0.0.1","TCP","44","61859  >  49350 [ACK] Seq=1 Ack=1 Win=65280 Len=0"
"130","32.368372","127.0.0.1","127.0.0.1","TCP","41132","61859  >  49350 [PSH, ACK] Seq=1 Ack=1 Win=65280 Len=41088"
"131","32.368403","127.0.0.1","127.0.0.1","TCP","44","49350  >  61859 [ACK] Seq=1 Ack=41089 Win=130816 Len=0"
"132","32.368414","127.0.0.1","127.0.0.1","TCP","44","61859  >  49350 [FIN, ACK] Seq=41089 Ack=1 Win=65280 Len=0"
"133","32.368422","127.0.0.1","127.0.0.1","TCP","44","49350  >  61859 [ACK] Seq=1 Ack=41090 Win=130816 Len=0"
"134","32.399613","127.0.0.1","127.0.0.1","TCP","44","49350  >  61858 [FIN, ACK] Seq=1 Ack=41090 Win=130816 Len=0"
"135","32.399650","127.0.0.1","127.0.0.1","TCP","44","61858  >  49350 [ACK] Seq=41090 Ack=2 Win=65280 Len=0"
"136","35.389507","127.0.0.1","127.0.0.1","TCP","56","61860  >  49350 [SYN] Seq=0 Win=65535 Len=0 MSS=65495 WS=256 SACK_PERM"
"137","35.389583","127.0.0.1","127.0.0.1","TCP","56","49350  >  61860 [SYN, ACK] Seq=0 Ack=1 Win=65535 Len=0 MSS=65495 WS=256 SACK_PERM"
"138","35.389636","127.0.0.1","127.0.0.1","TCP","44","61860  >  49350 [ACK] Seq=1 Ack=1 Win=65280 Len=0"
"139","35.389706","127.0.0.1","127.0.0.1","TCP","41132","61860  >  49350 [PSH, ACK] Seq=1 Ack=1 Win=65280 Len=41088"
"140","35.389755","127.0.0.1","127.0.0.1","TCP","44","49350  >  61860 [ACK] Seq=1 Ack=41089 Win=130816 Len=0"
"141","35.389776","127.0.0.1","127.0.0.1","TCP","44","61860  >  49350 [FIN, ACK] Seq=41089 Ack=1 Win=65280 Len=0"
"142","35.389790","127.0.0.1","127.0.0.1","TCP","44","49350  >  61860 [ACK] Seq=1 Ack=41090 Win=130816 Len=0"
"143","35.418714","127.0.0.1","127.0.0.1","TCP","44","49350  >  61860 [FIN, ACK] Seq=1 Ack=41090 Win=130816 Len=0"
"144","35.418788","127.0.0.1","127.0.0.1","TCP","44","61860  >  49350 [ACK] Seq=41090 Ack=2 Win=65280 Len=0"
"145","35.450384","127.0.0.1","127.0.0.1","TCP","44","49350  >  61859 [FIN, ACK] Seq=1 Ack=41090 Win=130816 Len=0"
"146","35.450457","127.0.0.1","127.0.0.1","TCP","44","61859  >  49350 [ACK] Seq=41090 Ack=2 Win=65280 Len=0"
"147","35.614574","127.0.0.1","127.0.0.1","TCP","56","61861  >  49350 [SYN] Seq=0 Win=65535 Len=0 MSS=65495 WS=256 SACK_PERM"
"148","35.614710","127.0.0.1","127.0.0.1","TCP","56","49350  >  61861 [SYN, ACK] Seq=0 Ack=1 Win=65535 Len=0 MSS=65495 WS=256 SACK_PERM"
"149","35.614790","127.0.0.1","127.0.0.1","TCP","44","61861  >  49350 [ACK] Seq=1 Ack=1 Win=65280 Len=0"
"150","35.614960","127.0.0.1","127.0.0.1","TCP","41132","61861  >  49350 [PSH, ACK] Seq=1 Ack=1 Win=65280 Len=41088"
"151","35.615060","127.0.0.1","127.0.0.1","TCP","44","49350  >  61861 [ACK] Seq=1 Ack=41089 Win=130816 Len=0"
"152","35.615120","127.0.0.1","127.0.0.1","TCP","44","61861  >  49350 [FIN, ACK] Seq=41089 Ack=1 Win=65280 Len=0"
"153","35.615148","127.0.0.1","127.0.0.1","TCP","44","49350  >  61861 [ACK] Seq=1 Ack=41090 Win=130816 Len=0"
"154","35.725966","127.0.0.1","127.0.0.1","TCP","44","49350  >  61861 [FIN, ACK] Seq=1 Ack=41090 Win=130816 Len=0"
"155","35.726021","127.0.0.1","127.0.0.1","TCP","44","61861  >  49350 [ACK] Seq=41090 Ack=2 Win=65280 Len=0"
"156","36.402592","127.0.0.1","127.0.0.1","TCP","56","61862  >  49350 [SYN] Seq=0 Win=65535 Len=0 MSS=65495 WS=256 SACK_PERM"
"157","36.402718","127.0.0.1","127.0.0.1","TCP","56","49350  >  61862 [SYN, ACK] Seq=0 Ack=1 Win=65535 Len=0 MSS=65495 WS=256 SACK_PERM"
"158","36.402807","127.0.0.1","127.0.0.1","TCP","44","61862  >  49350 [ACK] Seq=1 Ack=1 Win=65280 Len=0"
"159","36.402936","127.0.0.1","127.0.0.1","TCP","41132","61862  >  49350 [PSH, ACK] Seq=1 Ack=1 Win=65280 Len=41088"
"160","36.403012","127.0.0.1","127.0.0.1","TCP","44","49350  >  61862 [ACK] Seq=1 Ack=41089 Win=130816 Len=0"
"161","36.403050","127.0.0.1","127.0.0.1","TCP","44","61862  >  49350 [FIN, ACK] Seq=41089 Ack=1 Win=65280 Len=0"
"162","36.403074","127.0.0.1","127.0.0.1","TCP","44","49350  >  61862 [ACK] Seq=1 Ack=41090 Win=130816 Len=0"
"163","36.403461","127.0.0.1","127.0.0.1","TCP","56","61863  >  49350 [SYN] Seq=0 Win=65535 Len=0 MSS=65495 WS=256 SACK_PERM"
"164","36.403578","127.0.0.1","127.0.0.1","TCP","56","49350  >  61863 [SYN, ACK] Seq=0 Ack=1 Win=65535 Len=0 MSS=65495 WS=256 SACK_PERM"
"165","36.403642","127.0.0.1","127.0.0.1","TCP","44","61863  >  49350 [ACK] Seq=1 Ack=1 Win=65280 Len=0"
"166","36.403747","127.0.0.1","127.0.0.1","TCP","41132","61863  >  49350 [PSH, ACK] Seq=1 Ack=1 Win=65280 Len=41088"
"167","36.403850","127.0.0.1","127.0.0.1","TCP","44","49350  >  61863 [ACK] Seq=1 Ack=41089 Win=130816 Len=0"
"168","36.403897","127.0.0.1","127.0.0.1","TCP","44","61863  >  49350 [FIN, ACK] Seq=41089 Ack=1 Win=65280 Len=0"
"169","36.403924","127.0.0.1","127.0.0.1","TCP","44","49350  >  61863 [ACK] Seq=1 Ack=41090 Win=130816 Len=0"
"170","36.438450","127.0.0.1","127.0.0.1","TCP","44","49350  >  61862 [FIN, ACK] Seq=1 Ack=41090 Win=130816 Len=0"
"171","36.438547","127.0.0.1","127.0.0.1","TCP","44","61862  >  49350 [ACK] Seq=41090 Ack=2 Win=65280 Len=0"
"172","37.399133","127.0.0.1","127.0.0.1","TCP","56","61864  >  49350 [SYN] Seq=0 Win=65535 Len=0 MSS=65495 WS=256 SACK_PERM"
"173","37.399227","127.0.0.1","127.0.0.1","TCP","56","49350  >  61864 [SYN, ACK] Seq=0 Ack=1 Win=65535 Len=0 MSS=65495 WS=256 SACK_PERM"
"174","37.399291","127.0.0.1","127.0.0.1","TCP","44","61864  >  49350 [ACK] Seq=1 Ack=1 Win=65280 Len=0"
"175","37.399385","127.0.0.1","127.0.0.1","TCP","41132","61864  >  49350 [PSH, ACK] Seq=1 Ack=1 Win=65280 Len=41088"
"176","37.399443","127.0.0.1","127.0.0.1","TCP","44","49350  >  61864 [ACK] Seq=1 Ack=41089 Win=130816 Len=0"
"177","37.399479","127.0.0.1","127.0.0.1","TCP","44","61864  >  49350 [FIN, ACK] Seq=41089 Ack=1 Win=65280 Len=0"
"178","37.399504","127.0.0.1","127.0.0.1","TCP","44","49350  >  61864 [ACK] Seq=1 Ack=41090 Win=130816 Len=0"
"179","37.399856","127.0.0.1","127.0.0.1","TCP","56","61865  >  49350 [SYN] Seq=0 Win=65535 Len=0 MSS=65495 WS=256 SACK_PERM"
"180","37.399949","127.0.0.1","127.0.0.1","TCP","56","49350  >  61865 [SYN, ACK] Seq=0 Ack=1 Win=65535 Len=0 MSS=65495 WS=256 SACK_PERM"
"181","37.399996","127.0.0.1","127.0.0.1","TCP","44","61865  >  49350 [ACK] Seq=1 Ack=1 Win=65280 Len=0"
"182","37.400150","127.0.0.1","127.0.0.1","TCP","41132","61865  >  49350 [PSH, ACK] Seq=1 Ack=1 Win=65280 Len=41088"
"183","37.400232","127.0.0.1","127.0.0.1","TCP","44","49350  >  61865 [ACK] Seq=1 Ack=41089 Win=130816 Len=0"
"184","37.400276","127.0.0.1","127.0.0.1","TCP","44","61865  >  49350 [FIN, ACK] Seq=41089 Ack=1 Win=65280 Len=0"
"185","37.400303","127.0.0.1","127.0.0.1","TCP","44","49350  >  61865 [ACK] Seq=1 Ack=41090 Win=130816 Len=0"
"186","37.430670","127.0.0.1","127.0.0.1","TCP","44","49350  >  61864 [FIN, ACK] Seq=1 Ack=41090 Win=130816 Len=0"
"187","37.430756","127.0.0.1","127.0.0.1","TCP","44","61864  >  49350 [ACK] Seq=41090 Ack=2 Win=65280 Len=0"
"188","37.462766","127.0.0.1","127.0.0.1","TCP","44","49350  >  61863 [FIN, ACK] Seq=1 Ack=41090 Win=130816 Len=0"
"189","37.462886","127.0.0.1","127.0.0.1","TCP","44","61863  >  49350 [ACK] Seq=41090 Ack=2 Win=65280 Len=0"
"190","38.408591","127.0.0.1","127.0.0.1","TCP","56","61866  >  49350 [SYN] Seq=0 Win=65535 Len=0 MSS=65495 WS=256 SACK_PERM"
"191","38.408701","127.0.0.1","127.0.0.1","TCP","56","49350  >  61866 [SYN, ACK] Seq=0 Ack=1 Win=65535 Len=0 MSS=65495 WS=256 SACK_PERM"
"192","38.408784","127.0.0.1","127.0.0.1","TCP","44","61866  >  49350 [ACK] Seq=1 Ack=1 Win=65280 Len=0"
"193","38.408895","127.0.0.1","127.0.0.1","TCP","41132","61866  >  49350 [PSH, ACK] Seq=1 Ack=1 Win=65280 Len=41088"
"194","38.408965","127.0.0.1","127.0.0.1","TCP","44","49350  >  61866 [ACK] Seq=1 Ack=41089 Win=130816 Len=0"
"195","38.409001","127.0.0.1","127.0.0.1","TCP","44","61866  >  49350 [FIN, ACK] Seq=41089 Ack=1 Win=65280 Len=0"
"196","38.409023","127.0.0.1","127.0.0.1","TCP","44","49350  >  61866 [ACK] Seq=1 Ack=41090 Win=130816 Len=0"
"197","38.409388","127.0.0.1","127.0.0.1","TCP","56","61867  >  49350 [SYN] Seq=0 Win=65535 Len=0 MSS=65495 WS=256 SACK_PERM"
"198","38.409469","127.0.0.1","127.0.0.1","TCP","56","49350  >  61867 [SYN, ACK] Seq=0 Ack=1 Win=65535 Len=0 MSS=65495 WS=256 SACK_PERM"
"199","38.409519","127.0.0.1","127.0.0.1","TCP","44","61867  >  49350 [ACK] Seq=1 Ack=1 Win=65280 Len=0"
"200","38.409595","127.0.0.1","127.0.0.1","TCP","41132","61867  >  49350 [PSH, ACK] Seq=1 Ack=1 Win=65280 Len=41088"
"201","38.409658","127.0.0.1","127.0.0.1","TCP","44","49350  >  61867 [ACK] Seq=1 Ack=41089 Win=130816 Len=0"
"202","38.409685","127.0.0.1","127.0.0.1","TCP","44","61867  >  49350 [FIN, ACK] Seq=41089 Ack=1 Win=65280 Len=0"
"203","38.409705","127.0.0.1","127.0.0.1","TCP","44","49350  >  61867 [ACK] Seq=1 Ack=41090 Win=130816 Len=0"
"204","38.410041","127.0.0.1","127.0.0.1","TCP","56","61868  >  49350 [SYN] Seq=0 Win=65535 Len=0 MSS=65495 WS=256 SACK_PERM"
"205","38.410116","127.0.0.1","127.0.0.1","TCP","56","49350  >  61868 [SYN, ACK] Seq=0 Ack=1 Win=65535 Len=0 MSS=65495 WS=256 SACK_PERM"
"206","38.410163","127.0.0.1","127.0.0.1","TCP","44","61868  >  49350 [ACK] Seq=1 Ack=1 Win=65280 Len=0"
"207","38.410236","127.0.0.1","127.0.0.1","TCP","41132","61868  >  49350 [PSH, ACK] Seq=1 Ack=1 Win=65280 Len=41088"
"208","38.410299","127.0.0.1","127.0.0.1","TCP","44","49350  >  61868 [ACK] Seq=1 Ack=41089 Win=130816 Len=0"
"209","38.410325","127.0.0.1","127.0.0.1","TCP","44","61868  >  49350 [FIN, ACK] Seq=41089 Ack=1 Win=65280 Len=0"
"210","38.410343","127.0.0.1","127.0.0.1","TCP","44","49350  >  61868 [ACK] Seq=1 Ack=41090 Win=130816 Len=0"
"211","38.410627","127.0.0.1","127.0.0.1","TCP","56","61869  >  49350 [SYN] Seq=0 Win=65535 Len=0 MSS=65495 WS=256 SACK_PERM"
"212","38.410696","127.0.0.1","127.0.0.1","TCP","56","49350  >  61869 [SYN, ACK] Seq=0 Ack=1 Win=65535 Len=0 MSS=65495 WS=256 SACK_PERM"
"213","38.410743","127.0.0.1","127.0.0.1","TCP","44","61869  >  49350 [ACK] Seq=1 Ack=1 Win=65280 Len=0"
"214","38.410814","127.0.0.1","127.0.0.1","TCP","41132","61869  >  49350 [PSH, ACK] Seq=1 Ack=1 Win=65280 Len=41088"
"215","38.410880","127.0.0.1","127.0.0.1","TCP","44","49350  >  61869 [ACK] Seq=1 Ack=41089 Win=130816 Len=0"
"216","38.410906","127.0.0.1","127.0.0.1","TCP","44","61869  >  49350 [FIN, ACK] Seq=41089 Ack=1 Win=65280 Len=0"
"217","38.410924","127.0.0.1","127.0.0.1","TCP","44","49350  >  61869 [ACK] Seq=1 Ack=41090 Win=130816 Len=0"
"218","38.411972","127.0.0.1","127.0.0.1","TCP","56","61870  >  49350 [SYN] Seq=0 Win=65535 Len=0 MSS=65495 WS=256 SACK_PERM"
"219","38.412063","127.0.0.1","127.0.0.1","TCP","56","49350  >  61870 [SYN, ACK] Seq=0 Ack=1 Win=65535 Len=0 MSS=65495 WS=256 SACK_PERM"
"220","38.412125","127.0.0.1","127.0.0.1","TCP","44","61870  >  49350 [ACK] Seq=1 Ack=1 Win=65280 Len=0"
"221","38.412218","127.0.0.1","127.0.0.1","TCP","41132","61870  >  49350 [PSH, ACK] Seq=1 Ack=1 Win=65280 Len=41088"
"222","38.412296","127.0.0.1","127.0.0.1","TCP","44","49350  >  61870 [ACK] Seq=1 Ack=41089 Win=130816 Len=0"
"223","38.412331","127.0.0.1","127.0.0.1","TCP","44","61870  >  49350 [FIN, ACK] Seq=41089 Ack=1 Win=65280 Len=0"
"224","38.412352","127.0.0.1","127.0.0.1","TCP","44","49350  >  61870 [ACK] Seq=1 Ack=41090 Win=130816 Len=0"
"225","38.412680","127.0.0.1","127.0.0.1","TCP","56","61871  >  49350 [SYN] Seq=0 Win=65535 Len=0 MSS=65495 WS=256 SACK_PERM"
"226","38.412754","127.0.0.1","127.0.0.1","TCP","56","49350  >  61871 [SYN, ACK] Seq=0 Ack=1 Win=65535 Len=0 MSS=65495 WS=256 SACK_PERM"
"227","38.412805","127.0.0.1","127.0.0.1","TCP","44","61871  >  49350 [ACK] Seq=1 Ack=1 Win=65280 Len=0"
"228","38.412882","127.0.0.1","127.0.0.1","TCP","41132","61871  >  49350 [PSH, ACK] Seq=1 Ack=1 Win=65280 Len=41088"
"229","38.412950","127.0.0.1","127.0.0.1","TCP","44","49350  >  61871 [ACK] Seq=1 Ack=41089 Win=130816 Len=0"
"230","38.412976","127.0.0.1","127.0.0.1","TCP","44","61871  >  49350 [FIN, ACK] Seq=41089 Ack=1 Win=65280 Len=0"
"231","38.412995","127.0.0.1","127.0.0.1","TCP","44","49350  >  61871 [ACK] Seq=1 Ack=41090 Win=130816 Len=0"
"232","38.439442","127.0.0.1","127.0.0.1","TCP","44","49350  >  61866 [FIN, ACK] Seq=1 Ack=41090 Win=130816 Len=0"
"233","38.439511","127.0.0.1","127.0.0.1","TCP","44","61866  >  49350 [ACK] Seq=41090 Ack=2 Win=65280 Len=0"
"234","38.471337","127.0.0.1","127.0.0.1","TCP","44","49350  >  61865 [FIN, ACK] Seq=1 Ack=41090 Win=130816 Len=0"
"235","38.471427","127.0.0.1","127.0.0.1","TCP","44","61865  >  49350 [ACK] Seq=41090 Ack=2 Win=65280 Len=0"
"236","43.441407","127.0.0.1","127.0.0.1","TCP","56","61872  >  49350 [SYN] Seq=0 Win=65535 Len=0 MSS=65495 WS=256 SACK_PERM"
"237","43.441564","127.0.0.1","127.0.0.1","TCP","56","49350  >  61872 [SYN, ACK] Seq=0 Ack=1 Win=65535 Len=0 MSS=65495 WS=256 SACK_PERM"
"238","43.441660","127.0.0.1","127.0.0.1","TCP","44","61872  >  49350 [ACK] Seq=1 Ack=1 Win=65280 Len=0"
"239","43.441796","127.0.0.1","127.0.0.1","TCP","41132","61872  >  49350 [PSH, ACK] Seq=1 Ack=1 Win=65280 Len=41088"
"240","43.441888","127.0.0.1","127.0.0.1","TCP","44","49350  >  61872 [ACK] Seq=1 Ack=41089 Win=130816 Len=0"
"241","43.441943","127.0.0.1","127.0.0.1","TCP","44","61872  >  49350 [FIN, ACK] Seq=41089 Ack=1 Win=65280 Len=0"
"242","43.441969","127.0.0.1","127.0.0.1","TCP","44","49350  >  61872 [ACK] Seq=1 Ack=41090 Win=130816 Len=0"
"243","43.472655","127.0.0.1","127.0.0.1","TCP","44","49350  >  61872 [FIN, ACK] Seq=1 Ack=41090 Win=130816 Len=0"
"244","43.472746","127.0.0.1","127.0.0.1","TCP","44","61872  >  49350 [ACK] Seq=41090 Ack=2 Win=65280 Len=0"
"245","43.505078","127.0.0.1","127.0.0.1","TCP","44","49350  >  61871 [FIN, ACK] Seq=1 Ack=41090 Win=130816 Len=0"
"246","43.505191","127.0.0.1","127.0.0.1","TCP","44","61871  >  49350 [ACK] Seq=41090 Ack=2 Win=65280 Len=0"
"247","43.537205","127.0.0.1","127.0.0.1","TCP","44","49350  >  61870 [FIN, ACK] Seq=1 Ack=41090 Win=130816 Len=0"
"248","43.537314","127.0.0.1","127.0.0.1","TCP","44","61870  >  49350 [ACK] Seq=41090 Ack=2 Win=65280 Len=0"
"249","43.550830","127.0.0.1","127.0.0.1","TCP","56","61873  >  49350 [SYN] Seq=0 Win=65535 Len=0 MSS=65495 WS=256 SACK_PERM"
"250","43.550983","127.0.0.1","127.0.0.1","TCP","56","49350  >  61873 [SYN, ACK] Seq=0 Ack=1 Win=65535 Len=0 MSS=65495 WS=256 SACK_PERM"
"251","43.551087","127.0.0.1","127.0.0.1","TCP","44","61873  >  49350 [ACK] Seq=1 Ack=1 Win=65280 Len=0"
"252","43.551254","127.0.0.1","127.0.0.1","TCP","41132","61873  >  49350 [PSH, ACK] Seq=1 Ack=1 Win=65280 Len=41088"
"253","43.551343","127.0.0.1","127.0.0.1","TCP","44","49350  >  61873 [ACK] Seq=1 Ack=41089 Win=130816 Len=0"
"254","43.551388","127.0.0.1","127.0.0.1","TCP","44","61873  >  49350 [FIN, ACK] Seq=41089 Ack=1 Win=65280 Len=0"
"255","43.551429","127.0.0.1","127.0.0.1","TCP","44","49350  >  61873 [ACK] Seq=1 Ack=41090 Win=130816 Len=0"
"256","43.552000","127.0.0.1","127.0.0.1","TCP","56","61874  >  49350 [SYN] Seq=0 Win=65535 Len=0 MSS=65495 WS=256 SACK_PERM"
"257","43.552137","127.0.0.1","127.0.0.1","TCP","56","49350  >  61874 [SYN, ACK] Seq=0 Ack=1 Win=65535 Len=0 MSS=65495 WS=256 SACK_PERM"
"258","43.552234","127.0.0.1","127.0.0.1","TCP","44","61874  >  49350 [ACK] Seq=1 Ack=1 Win=65280 Len=0"
"259","43.552384","127.0.0.1","127.0.0.1","TCP","41132","61874  >  49350 [PSH, ACK] Seq=1 Ack=1 Win=65280 Len=41088"
"260","43.552505","127.0.0.1","127.0.0.1","TCP","44","49350  >  61874 [ACK] Seq=1 Ack=41089 Win=130816 Len=0"
"261","43.552558","127.0.0.1","127.0.0.1","TCP","44","61874  >  49350 [FIN, ACK] Seq=41089 Ack=1 Win=65280 Len=0"
"262","43.552582","127.0.0.1","127.0.0.1","TCP","44","49350  >  61874 [ACK] Seq=1 Ack=41090 Win=130816 Len=0"
"263","43.568495","127.0.0.1","127.0.0.1","TCP","44","49350  >  61869 [FIN, ACK] Seq=1 Ack=41090 Win=130816 Len=0"
"264","43.568567","127.0.0.1","127.0.0.1","TCP","44","61869  >  49350 [ACK] Seq=41090 Ack=2 Win=65280 Len=0"
"265","43.599917","127.0.0.1","127.0.0.1","TCP","44","49350  >  61868 [FIN, ACK] Seq=1 Ack=41090 Win=130816 Len=0"
"266","43.599990","127.0.0.1","127.0.0.1","TCP","44","61868  >  49350 [ACK] Seq=41090 Ack=2 Win=65280 Len=0"
"267","43.632055","127.0.0.1","127.0.0.1","TCP","44","49350  >  61867 [FIN, ACK] Seq=1 Ack=41090 Win=130816 Len=0"
"268","43.632148","127.0.0.1","127.0.0.1","TCP","44","61867  >  49350 [ACK] Seq=41090 Ack=2 Win=65280 Len=0"
"269","62.662339","127.0.0.1","127.0.0.1","TCP","56","61875  >  49350 [SYN] Seq=0 Win=65535 Len=0 MSS=65495 WS=256 SACK_PERM"
"270","62.662512","127.0.0.1","127.0.0.1","TCP","56","49350  >  61875 [SYN, ACK] Seq=0 Ack=1 Win=65535 Len=0 MSS=65495 WS=256 SACK_PERM"
"271","62.662599","127.0.0.1","127.0.0.1","TCP","44","61875  >  49350 [ACK] Seq=1 Ack=1 Win=65280 Len=0"
"272","62.662722","127.0.0.1","127.0.0.1","TCP","41132","61875  >  49350 [PSH, ACK] Seq=1 Ack=1 Win=65280 Len=41088"
"273","62.662807","127.0.0.1","127.0.0.1","TCP","44","49350  >  61875 [ACK] Seq=1 Ack=41089 Win=130816 Len=0"
"274","62.662849","127.0.0.1","127.0.0.1","TCP","44","61875  >  49350 [FIN, ACK] Seq=41089 Ack=1 Win=65280 Len=0"
"275","62.662875","127.0.0.1","127.0.0.1","TCP","44","49350  >  61875 [ACK] Seq=1 Ack=41090 Win=130816 Len=0"
"276","62.663311","127.0.0.1","127.0.0.1","TCP","56","61876  >  49350 [SYN] Seq=0 Win=65535 Len=0 MSS=65495 WS=256 SACK_PERM"
"277","62.663405","127.0.0.1","127.0.0.1","TCP","56","49350  >  61876 [SYN, ACK] Seq=0 Ack=1 Win=65535 Len=0 MSS=65495 WS=256 SACK_PERM"
"278","62.663468","127.0.0.1","127.0.0.1","TCP","44","61876  >  49350 [ACK] Seq=1 Ack=1 Win=65280 Len=0"
"279","62.663564","127.0.0.1","127.0.0.1","TCP","41132","61876  >  49350 [PSH, ACK] Seq=1 Ack=1 Win=65280 Len=41088"
"280","62.663640","127.0.0.1","127.0.0.1","TCP","44","49350  >  61876 [ACK] Seq=1 Ack=41089 Win=130816 Len=0"
"281","62.663675","127.0.0.1","127.0.0.1","TCP","44","61876  >  49350 [FIN, ACK] Seq=41089 Ack=1 Win=65280 Len=0"
"282","62.663698","127.0.0.1","127.0.0.1","TCP","44","49350  >  61876 [ACK] Seq=1 Ack=41090 Win=130816 Len=0"
"283","62.694471","127.0.0.1","127.0.0.1","TCP","44","49350  >  61875 [FIN, ACK] Seq=1 Ack=41090 Win=130816 Len=0"
"284","62.694559","127.0.0.1","127.0.0.1","TCP","44","61875  >  49350 [ACK] Seq=41090 Ack=2 Win=65280 Len=0"
"285","62.726380","127.0.0.1","127.0.0.1","TCP","44","49350  >  61874 [FIN, ACK] Seq=1 Ack=41090 Win=130816 Len=0"
"286","62.726482","127.0.0.1","127.0.0.1","TCP","44","61874  >  49350 [ACK] Seq=41090 Ack=2 Win=65280 Len=0"
"287","62.758645","127.0.0.1","127.0.0.1","TCP","44","49350  >  61873 [FIN, ACK] Seq=1 Ack=41090 Win=130816 Len=0"
"288","62.758725","127.0.0.1","127.0.0.1","TCP","44","61873  >  49350 [ACK] Seq=41090 Ack=2 Win=65280 Len=0"
"289","93.033778","127.0.0.1","127.0.0.1","TCP","56","61877  >  49350 [SYN] Seq=0 Win=65535 Len=0 MSS=65495 WS=256 SACK_PERM"
"290","93.033910","127.0.0.1","127.0.0.1","TCP","56","49350  >  61877 [SYN, ACK] Seq=0 Ack=1 Win=65535 Len=0 MSS=65495 WS=256 SACK_PERM"
"291","93.033999","127.0.0.1","127.0.0.1","TCP","44","61877  >  49350 [ACK] Seq=1 Ack=1 Win=65280 Len=0"
"292","93.034124","127.0.0.1","127.0.0.1","TCP","41132","61877  >  49350 [PSH, ACK] Seq=1 Ack=1 Win=65280 Len=41088"
"293","93.034204","127.0.0.1","127.0.0.1","TCP","44","49350  >  61877 [ACK] Seq=1 Ack=41089 Win=130816 Len=0"
"294","93.034247","127.0.0.1","127.0.0.1","TCP","44","61877  >  49350 [FIN, ACK] Seq=41089 Ack=1 Win=65280 Len=0"
"295","93.034272","127.0.0.1","127.0.0.1","TCP","44","49350  >  61877 [ACK] Seq=1 Ack=41090 Win=130816 Len=0"
"296","93.034702","127.0.0.1","127.0.0.1","TCP","56","61878  >  49350 [SYN] Seq=0 Win=65535 Len=0 MSS=65495 WS=256 SACK_PERM"
"297","93.034797","127.0.0.1","127.0.0.1","TCP","56","49350  >  61878 [SYN, ACK] Seq=0 Ack=1 Win=65535 Len=0 MSS=65495 WS=256 SACK_PERM"
"298","93.034862","127.0.0.1","127.0.0.1","TCP","44","61878  >  49350 [ACK] Seq=1 Ack=1 Win=65280 Len=0"
"299","93.034956","127.0.0.1","127.0.0.1","TCP","41132","61878  >  49350 [PSH, ACK] Seq=1 Ack=1 Win=65280 Len=41088"
"300","93.035032","127.0.0.1","127.0.0.1","TCP","44","49350  >  61878 [ACK] Seq=1 Ack=41089 Win=130816 Len=0"
"301","93.035066","127.0.0.1","127.0.0.1","TCP","44","61878  >  49350 [FIN, ACK] Seq=41089 Ack=1 Win=65280 Len=0"
"302","93.035089","127.0.0.1","127.0.0.1","TCP","44","49350  >  61878 [ACK] Seq=1 Ack=41090 Win=130816 Len=0"
"303","93.066250","127.0.0.1","127.0.0.1","TCP","44","49350  >  61877 [FIN, ACK] Seq=1 Ack=41090 Win=130816 Len=0"
"304","93.066335","127.0.0.1","127.0.0.1","TCP","44","61877  >  49350 [ACK] Seq=41090 Ack=2 Win=65280 Len=0"
"305","93.098354","127.0.0.1","127.0.0.1","TCP","44","49350  >  61876 [FIN, ACK] Seq=1 Ack=41090 Win=130816 Len=0"
"306","93.098438","127.0.0.1","127.0.0.1","TCP","44","61876  >  49350 [ACK] Seq=41090 Ack=2 Win=65280 Len=0"
"307","122.386371","127.0.0.1","127.0.0.1","TCP","56","61880  >  49350 [SYN] Seq=0 Win=65535 Len=0 MSS=65495 WS=256 SACK_PERM"
"308","122.386503","127.0.0.1","127.0.0.1","TCP","56","49350  >  61880 [SYN, ACK] Seq=0 Ack=1 Win=65535 Len=0 MSS=65495 WS=256 SACK_PERM"
"309","122.386600","127.0.0.1","127.0.0.1","TCP","44","61880  >  49350 [ACK] Seq=1 Ack=1 Win=65280 Len=0"
"310","122.386736","127.0.0.1","127.0.0.1","TCP","41132","61880  >  49350 [PSH, ACK] Seq=1 Ack=1 Win=65280 Len=41088"
"311","122.386819","127.0.0.1","127.0.0.1","TCP","44","49350  >  61880 [ACK] Seq=1 Ack=41089 Win=130816 Len=0"
"312","122.386865","127.0.0.1","127.0.0.1","TCP","44","61880  >  49350 [FIN, ACK] Seq=41089 Ack=1 Win=65280 Len=0"
"313","122.386891","127.0.0.1","127.0.0.1","TCP","44","49350  >  61880 [ACK] Seq=1 Ack=41090 Win=130816 Len=0"
"314","122.418163","127.0.0.1","127.0.0.1","TCP","44","49350  >  61880 [FIN, ACK] Seq=1 Ack=41090 Win=130816 Len=0"
"315","122.418264","127.0.0.1","127.0.0.1","TCP","44","61880  >  49350 [ACK] Seq=41090 Ack=2 Win=65280 Len=0"
"316","122.450544","127.0.0.1","127.0.0.1","TCP","44","49350  >  61878 [FIN, ACK] Seq=1 Ack=41090 Win=130816 Len=0"
"317","122.450628","127.0.0.1","127.0.0.1","TCP","44","61878  >  49350 [ACK] Seq=41090 Ack=2 Win=65280 Len=0"
"318","202.335991","127.0.0.1","127.0.0.1","TCP","56","61883  >  49350 [SYN] Seq=0 Win=65535 Len=0 MSS=65495 WS=256 SACK_PERM"
"319","202.336118","127.0.0.1","127.0.0.1","TCP","56","49350  >  61883 [SYN, ACK] Seq=0 Ack=1 Win=65535 Len=0 MSS=65495 WS=256 SACK_PERM"
"320","202.336209","127.0.0.1","127.0.0.1","TCP","44","61883  >  49350 [ACK] Seq=1 Ack=1 Win=65280 Len=0"
"321","202.336341","127.0.0.1","127.0.0.1","TCP","41132","61883  >  49350 [PSH, ACK] Seq=1 Ack=1 Win=65280 Len=41088"
"322","202.336425","127.0.0.1","127.0.0.1","TCP","44","49350  >  61883 [ACK] Seq=1 Ack=41089 Win=130816 Len=0"
"323","202.336468","127.0.0.1","127.0.0.1","TCP","44","61883  >  49350 [FIN, ACK] Seq=41089 Ack=1 Win=65280 Len=0"
"324","202.336495","127.0.0.1","127.0.0.1","TCP","44","49350  >  61883 [ACK] Seq=1 Ack=41090 Win=130816 Len=0"
"325","202.336932","127.0.0.1","127.0.0.1","TCP","56","61884  >  49350 [SYN] Seq=0 Win=65535 Len=0 MSS=65495 WS=256 SACK_PERM"
"326","202.337034","127.0.0.1","127.0.0.1","TCP","56","49350  >  61884 [SYN, ACK] Seq=0 Ack=1 Win=65535 Len=0 MSS=65495 WS=256 SACK_PERM"
"327","202.337096","127.0.0.1","127.0.0.1","TCP","44","61884  >  49350 [ACK] Seq=1 Ack=1 Win=65280 Len=0"
"328","202.337201","127.0.0.1","127.0.0.1","TCP","41132","61884  >  49350 [PSH, ACK] Seq=1 Ack=1 Win=65280 Len=41088"
"329","202.337297","127.0.0.1","127.0.0.1","TCP","44","49350  >  61884 [ACK] Seq=1 Ack=41089 Win=130816 Len=0"
"330","202.337334","127.0.0.1","127.0.0.1","TCP","44","61884  >  49350 [FIN, ACK] Seq=41089 Ack=1 Win=65280 Len=0"
"331","202.337356","127.0.0.1","127.0.0.1","TCP","44","49350  >  61884 [ACK] Seq=1 Ack=41090 Win=130816 Len=0"
"332","202.337737","127.0.0.1","127.0.0.1","TCP","56","61885  >  49350 [SYN] Seq=0 Win=65535 Len=0 MSS=65495 WS=256 SACK_PERM"
"333","202.337856","127.0.0.1","127.0.0.1","TCP","56","49350  >  61885 [SYN, ACK] Seq=0 Ack=1 Win=65535 Len=0 MSS=65495 WS=256 SACK_PERM"
"334","202.337913","127.0.0.1","127.0.0.1","TCP","44","61885  >  49350 [ACK] Seq=1 Ack=1 Win=65280 Len=0"
"335","202.338001","127.0.0.1","127.0.0.1","TCP","41132","61885  >  49350 [PSH, ACK] Seq=1 Ack=1 Win=65280 Len=41088"
"336","202.338074","127.0.0.1","127.0.0.1","TCP","44","49350  >  61885 [ACK] Seq=1 Ack=41089 Win=130816 Len=0"
"337","202.338107","127.0.0.1","127.0.0.1","TCP","44","61885  >  49350 [FIN, ACK] Seq=41089 Ack=1 Win=65280 Len=0"
"338","202.338127","127.0.0.1","127.0.0.1","TCP","44","49350  >  61885 [ACK] Seq=1 Ack=41090 Win=130816 Len=0"
"339","202.367280","127.0.0.1","127.0.0.1","TCP","44","49350  >  61883 [FIN, ACK] Seq=1 Ack=41090 Win=130816 Len=0"
"340","202.367364","127.0.0.1","127.0.0.1","TCP","44","61883  >  49350 [ACK] Seq=41090 Ack=2 Win=65280 Len=0"
"341","239.691302","2001:0:14c9:d804:3c35:7b0a:ab8c:2233","ff02::1","IPv6","72","IPv6 no next header"
"342","239.777933","127.0.0.1","127.0.0.1","TCP","56","61886  >  49350 [SYN] Seq=0 Win=65535 Len=0 MSS=65495 WS=256 SACK_PERM"
"343","239.778072","127.0.0.1","127.0.0.1","TCP","56","49350  >  61886 [SYN, ACK] Seq=0 Ack=1 Win=65535 Len=0 MSS=65495 WS=256 SACK_PERM"
"344","239.778170","127.0.0.1","127.0.0.1","TCP","44","61886  >  49350 [ACK] Seq=1 Ack=1 Win=65280 Len=0"
"345","239.778299","127.0.0.1","127.0.0.1","TCP","41132","61886  >  49350 [PSH, ACK] Seq=1 Ack=1 Win=65280 Len=41088"
